{
  "plan_id": "plan_model_locked",
  "session_id": "labs_extent_1",
  "planner": "model",
  "planner_fell_back_from": null,
  "selected_organ": "extent",
  "mode": "isolation",
  "proposed_steps": [
    {
      "step_id": "step_2",
      "organ": "topology",
      "operation": "topology.adjacency",
      "parameters": {},
      "input_refs": [
        {"role": "source", "scope": "session", "artifact_id": "art_extent_1"},
        {"role": "target", "scope": "session", "artifact_id": "art_extent_manual"}
      ],
      "rationale": "'do those two touch?' asks for a relation between the two selected extents"
    }
  ],
  "resolved_steps": [],
  "prerequisites": [],
  "refusals": [
    {
      "code": "organ_locked",
      "organ": "extent",
      "operation": "topology.adjacency",
      "message": "topology.adjacency belongs to the topology organ; this session is locked to extent.",
      "missing": [],
      "remedy": "switch to chain mode and confirm, or select the topology organ",
      "detail": {"operation_organ": "topology"}
    }
  ],
  "dropped_parameters": [],
  "clamped_parameters": [],
  "requires_confirmation": false,
  "created_at": "2026-08-10T09:02:01Z"
}
